{
  "$schema": "https://json-schema.org/draft/2020-12/schema",
  "$id": "https://continuum.dev/schema/v1/proof-receipt.json",
  "schema_epoch": 1,
  "schema_kind": "artifact",
  "title": "Continuum Proof Receipt",
  "type": "object",
  "$defs": {
    "redacted": {
      "$comment": "mirrored from redacted.schema.json; identity-checked by the validator",
      "type": "object",
      "description": "Typed Redacted(reason, commitment) stub (plan §4.5). Mirrors redacted.schema.json; inlined to keep this file self-contained.",
      "required": ["redacted", "reason", "commitment", "original_class"],
      "properties": {
        "redacted": { "const": true },
        "reason": { "enum": ["summarized", "lost", "purged"] },
        "commitment": {
          "description": "Content commitment (hash) of the redacted original.",
          "type": "string"
        },
        "original_class": {
          "description": "Artifact class of the redacted original (plan §4.4 prefix, e.g. crash, ctx, proof).",
          "type": "string"
        }
      },
      "additionalProperties": false
    }
  },
  "required": [
    "schema_id", "schema_epoch", "receipt_id", "claim", "closure", "epochs",
    "transformations", "certificate", "checker", "reproduce"
  ],
  "allOf": [
    {
      "description": "The lean block is required only for Lean-flavored certificates; kernel-checked SAT/closed-set certificates are Lean-free (plan §20).",
      "if": {
        "properties": {
          "certificate": {
            "properties": { "kind": { "const": "lean-theorem" } },
            "required": ["kind"]
          }
        },
        "required": ["certificate"]
      },
      "then": { "required": ["lean"] }
    }
  ],
  "properties": {
    "schema_id": {
      "const": "https://continuum.dev/schema/proof-receipt.json",
      "description": "Artifact-class identity of the governing schema: its `$id` with the `v<schema_epoch>/` segment removed (schemas/README.md). Stable across schema epochs."
    },
    "schema_epoch": {
      "const": 1,
      "description": "Schema epoch this instance was written against (schemas/README.md). It advances only on a breaking change to this artifact class, is not one of the six independently versioned epochs (RFC 0026 `rule versioning.epoch_independence`), and pins no semantics."
    },
    "receipt_id": { "type": "string", "pattern": "^receipt_[A-Za-z0-9_-]+$" },
    "claim": {
      "type": "object",
      "required": ["kind", "text", "property_hash", "verdict"],
      "properties": {
        "kind": {
          "enum": ["safety", "liveness", "refinement", "reduction", "conformance", "hyperproperty"]
        },
        "text": { "type": "string" },
        "property_hash": { "type": "string" },
        "verdict": { "enum": ["established", "refuted"] }
      },
      "additionalProperties": false
    },
    "closure": {
      "type": "object",
      "required": ["model_hash", "assumptions_hash", "observers_hash"],
      "properties": {
        "model_hash": { "type": "string" },
        "implementation_hash": { "type": "string" },
        "assumptions_hash": { "type": "string" },
        "observers_hash": { "type": "string" },
        "domain_pack_hashes": {
          "type": "array", "items": { "type": "string" }
        }
      },
      "additionalProperties": false
    },
    "epochs": {
      "type": "object",
      "required": ["semantic", "proof"],
      "properties": {
        "semantic": { "type": "string" },
        "proof": { "type": "string" },
        "corpus": { "type": "string" }
      },
      "additionalProperties": false
    },
    "transformations": {
      "type": "array",
      "items": {
        "type": "object",
        "required": ["name", "input_hash", "output_hash", "preservation", "evidence_hash"],
        "properties": {
          "name": { "type": "string" },
          "input_hash": { "type": "string" },
          "output_hash": { "type": "string" },
          "preservation": {
            "enum": ["equivalence", "simulation", "trace-language", "property", "equisatisfiable"]
          },
          "evidence_hash": { "type": "string" }
        },
        "additionalProperties": false
      }
    },
    "certificate": {
      "type": "object",
      "required": ["kind", "hash"],
      "properties": {
        "kind": {
          "enum": [
            "closed-set", "inductive-invariant", "simulation", "fair-scc-exclusion",
            "ranking", "lrat", "veripb", "smt-proof", "game-strategy", "lean-theorem"
          ]
        },
        "hash": { "type": "string" },
        "path": { "type": "string" }
      },
      "additionalProperties": false
    },
    "checker": {
      "type": "object",
      "required": ["name", "version", "source_hash", "binary_hash", "toolchain"],
      "properties": {
        "name": { "type": "string" },
        "version": { "type": "string" },
        "source_hash": { "type": "string" },
        "binary_hash": { "type": "string" },
        "toolchain": {
          "description": "Toolchain identity that produced the checker build (INV-014: build digest and toolchain identity).",
          "type": "string"
        },
        "independent": { "type": "boolean" }
      },
      "additionalProperties": false
    },
    "lean": {
      "type": "object",
      "required": ["version", "theorems", "imports", "axioms"],
      "properties": {
        "version": { "type": "string" },
        "theorems": { "type": "array", "minItems": 1, "items": { "type": "string" } },
        "imports": { "type": "array", "items": { "type": "string" } },
        "axioms": { "type": "array", "items": { "type": "string" } },
        "environment_hash": { "type": "string" },
        "independent_checker": { "type": "string" }
      },
      "additionalProperties": false
    },
    "axiom_manifest": {
      "type": "object",
      "description": "Structured axiom manifest referenced alongside lean.axioms.",
      "required": ["hash", "axioms"],
      "properties": {
        "hash": { "type": "string" },
        "axioms": { "type": "array", "items": { "type": "string" } }
      },
      "additionalProperties": false
    },
    "redactions": {
      "description": "Redacted values referenced by this receipt (plan §4.5, §18.4).",
      "type": "array",
      "items": { "$ref": "#/$defs/redacted" }
    },
    "reproduce": {
      "type": "array", "minItems": 1, "items": { "type": "string" }
    },
    "signatures": {
      "type": "array", "items": { "type": "object", "additionalProperties": true }
    }
  },
  "additionalProperties": false
}
